{
  "schema_version": 1,
  "atlas_id": "frontend-behavior-atlas",
  "generated_at": "2026-08-28T00:00:00+09:00",
  "status": "incomplete-human-review-required",
  "queue_id": "authority-review-997bcfdd38615ccd1588",
  "input_digest": "sha256:b55719bea06785b16b3b5a3ce0d34df308e959240c41d3af79febecf078527f1",
  "tool_digest": "sha256:bb6b6059023e38b6f3fe16904b8b095100444cfd85813e3e489958795d401dc6",
  "decision_ledger": "authority/reviews/decisions.json",
  "body_storage": "digest-locator-and-offset-only",
  "machine_assistance": "dedupe-candidate-cluster-priority-and-batch-only",
  "semantic_decisions": "human-only",
  "summary": {
    "eligible_documents": 70,
    "queued_anchors": 15963,
    "pending_human": 15963,
    "human_reviewed": 0,
    "priority_counts": {
      "0": 80,
      "1": 12077,
      "2": 3806
    },
    "candidate_clusters": 1489,
    "clustered_anchors": 4887,
    "batches": 447,
    "stale_document_holds": 3,
    "decisions": 0,
    "included": 0,
    "excluded": 0,
    "merged": 0,
    "split": 0,
    "authority_semantics_exhaustive": false
  },
  "batches": [
    {
      "id": "review-p0-definition-20",
      "path": "authority/review-queue-draft/review-p0-definition-20.json",
      "digest": "sha256:1749b0915c7f67e1b23b99b0d2fe752e7024e85afad1f31c2100fa3385e32c70",
      "priority": 0,
      "semantic_kind": "definition",
      "bucket": "20",
      "items": 1
    },
    {
      "id": "review-p0-definition-35",
      "path": "authority/review-queue-draft/review-p0-definition-35.json",
      "digest": "sha256:ec8ec5acb4be00c09c96cf51438c73255f8fbf708aa52d612923605552e4b80e",
      "priority": 0,
      "semantic_kind": "definition",
      "bucket": "35",
      "items": 1
    },
    {
      "id": "review-p0-definition-3c",
      "path": "authority/review-queue-draft/review-p0-definition-3c.json",
      "digest": "sha256:ac5f080d53aa6c45b248f09d84821d1a7acc5b79838a179d8d70e11d418f4f70",
      "priority": 0,
      "semantic_kind": "definition",
      "bucket": "3c",
      "items": 1
    },
    {
      "id": "review-p0-document-root-00",
      "path": "authority/review-queue-draft/review-p0-document-root-00.json",
      "digest": "sha256:4e7a55d69c7bb094b0edd82ad4f5443255199b8c53b544e6d2f221f9cd355b1d",
      "priority": 0,
      "semantic_kind": "document-root",
      "bucket": "00",
      "items": 1
    },
    {
      "id": "review-p0-document-root-01",
      "path": "authority/review-queue-draft/review-p0-document-root-01.json",
      "digest": "sha256:9f32c329a6473e78a01b40016b79a4b0121a7c3257968554cb1c4d8e0097aee4",
      "priority": 0,
      "semantic_kind": "document-root",
      "bucket": "01",
      "items": 1
    },
    {
      "id": "review-p0-document-root-02",
      "path": "authority/review-queue-draft/review-p0-document-root-02.json",
      "digest": "sha256:0c2079e79cb7a32513535380577fc0b29c41652ed3af9b1dfc8d6c69344fd29e",
      "priority": 0,
      "semantic_kind": "document-root",
      "bucket": "02",
      "items": 1
    },
    {
      "id": "review-p0-document-root-05",
      "path": "authority/review-queue-draft/review-p0-document-root-05.json",
      "digest": "sha256:c72063a6078eacb895c576e22f48efe1f565500a90827501795993b8ca87779f",
      "priority": 0,
      "semantic_kind": "document-root",
      "bucket": "05",
      "items": 2
    },
    {
      "id": "review-p0-document-root-06",
      "path": "authority/review-queue-draft/review-p0-document-root-06.json",
      "digest": "sha256:e5f93086f1b3bd1ec12c68498e0ec221ac40c8ceed6efa43948788b10e70ec14",
      "priority": 0,
      "semantic_kind": "document-root",
      "bucket": "06",
      "items": 2
    },
    {
      "id": "review-p0-document-root-07",
      "path": "authority/review-queue-draft/review-p0-document-root-07.json",
      "digest": "sha256:2c868fdedbe889c9b15aefda300b4e2bfb0e57bc9e1326f83cd3ef6c3e85ba6d",
      "priority": 0,
      "semantic_kind": "document-root",
      "bucket": "07",
      "items": 2
    },
    {
      "id": "review-p0-document-root-08",
      "path": "authority/review-queue-draft/review-p0-document-root-08.json",
      "digest": "sha256:ddf368645a4c67534e4a9be183d8b2abef505a210eb824b4d6e5719210861ee5",
      "priority": 0,
      "semantic_kind": "document-root",
      "bucket": "08",
      "items": 2
    },
    {
      "id": "review-p0-document-root-09",
      "path": "authority/review-queue-draft/review-p0-document-root-09.json",
      "digest": "sha256:e6517e9a8b0b1d53e3631b7dae90848e568e8b3a078f7c5c313e0bbdbb4d75c7",
      "priority": 0,
      "semantic_kind": "document-root",
      "bucket": "09",
      "items": 3
    },
    {
      "id": "review-p0-document-root-0a",
      "path": "authority/review-queue-draft/review-p0-document-root-0a.json",
      "digest": "sha256:87fe6550b1ed0b62a8d5eafd024c0f6bede8a70ed3ff352326fb0ddf8ac30492",
      "priority": 0,
      "semantic_kind": "document-root",
      "bucket": "0a",
      "items": 1
    },
    {
      "id": "review-p0-document-root-0b",
      "path": "authority/review-queue-draft/review-p0-document-root-0b.json",
      "digest": "sha256:e9b2122243ec178a1ea7bace4ebf80e414b08a17a4207a5bed542d6ac5b799a3",
      "priority": 0,
      "semantic_kind": "document-root",
      "bucket": "0b",
      "items": 1
    },
    {
      "id": "review-p0-document-root-0c",
      "path": "authority/review-queue-draft/review-p0-document-root-0c.json",
      "digest": "sha256:7f15d7cde20c81ca822ba98c9f25ed490bf85ca8469d17d3b1b529b0ca4ee8d5",
      "priority": 0,
      "semantic_kind": "document-root",
      "bucket": "0c",
      "items": 2
    },
    {
      "id": "review-p0-document-root-0d",
      "path": "authority/review-queue-draft/review-p0-document-root-0d.json",
      "digest": "sha256:f789092e4a83c272991f77d76c8603e319baf2d55d4d49d7bf85c9eac6c768be",
      "priority": 0,
      "semantic_kind": "document-root",
      "bucket": "0d",
      "items": 6
    },
    {
      "id": "review-p0-document-root-0e",
      "path": "authority/review-queue-draft/review-p0-document-root-0e.json",
      "digest": "sha256:e020483a536fc7f4965fe4572f2010dbfc98a85dbc057b41c3bae09f9f5e87f3",
      "priority": 0,
      "semantic_kind": "document-root",
      "bucket": "0e",
      "items": 2
    },
    {
      "id": "review-p0-document-root-0f",
      "path": "authority/review-queue-draft/review-p0-document-root-0f.json",
      "digest": "sha256:927cd4af4c280859778dfadf0995faeb1763288e635652cdeebb169ebfaa705a",
      "priority": 0,
      "semantic_kind": "document-root",
      "bucket": "0f",
      "items": 2
    },
    {
      "id": "review-p0-document-root-10",
      "path": "authority/review-queue-draft/review-p0-document-root-10.json",
      "digest": "sha256:0e04ddd1a3b899e11a6df1e1cb74833cd4cb5bb46de0adcf5e5109f8cbd35b29",
      "priority": 0,
      "semantic_kind": "document-root",
      "bucket": "10",
      "items": 1
    },
    {
      "id": "review-p0-document-root-11",
      "path": "authority/review-queue-draft/review-p0-document-root-11.json",
      "digest": "sha256:4d840e7e2f80f53778d69580a38bde7f68c5a0e5e6d497b967b9d0fc66a2c6cd",
      "priority": 0,
      "semantic_kind": "document-root",
      "bucket": "11",
      "items": 1
    },
    {
      "id": "review-p0-document-root-16",
      "path": "authority/review-queue-draft/review-p0-document-root-16.json",
      "digest": "sha256:56862c31f0ea16432f373f9d04352a88d6f38b19047a8ef4950a66cc70b8b0f8",
      "priority": 0,
      "semantic_kind": "document-root",
      "bucket": "16",
      "items": 1
    },
    {
      "id": "review-p0-document-root-17",
      "path": "authority/review-queue-draft/review-p0-document-root-17.json",
      "digest": "sha256:a95bc952aeaa002749260ed7c5de9ae5997020b5f2275b5147694376ad2fe4b7",
      "priority": 0,
      "semantic_kind": "document-root",
      "bucket": "17",
      "items": 1
    },
    {
      "id": "review-p0-document-root-19",
      "path": "authority/review-queue-draft/review-p0-document-root-19.json",
      "digest": "sha256:9943e2c53ff0d74cb9fa4fecb0168357b9b304d08e67ae253819aa84df37f627",
      "priority": 0,
      "semantic_kind": "document-root",
      "bucket": "19",
      "items": 1
    },
    {
      "id": "review-p0-document-root-1a",
      "path": "authority/review-queue-draft/review-p0-document-root-1a.json",
      "digest": "sha256:6b69850d0154bffb4f0571ec8d4331346cc5dd7091ac69c7cfb47e97a72f4db8",
      "priority": 0,
      "semantic_kind": "document-root",
      "bucket": "1a",
      "items": 1
    },
    {
      "id": "review-p0-document-root-1b",
      "path": "authority/review-queue-draft/review-p0-document-root-1b.json",
      "digest": "sha256:7e89980e985b2ff5c2d739b097e07c652dc42b8b04fb8b257ab6fb7017156071",
      "priority": 0,
      "semantic_kind": "document-root",
      "bucket": "1b",
      "items": 1
    },
    {
      "id": "review-p0-document-root-1e",
      "path": "authority/review-queue-draft/review-p0-document-root-1e.json",
      "digest": "sha256:4dfb9b726f34e7395652084739f6fd2ce8c720a8e42768ba39f65c54b7ea23b0",
      "priority": 0,
      "semantic_kind": "document-root",
      "bucket": "1e",
      "items": 2
    },
    {
      "id": "review-p0-document-root-1f",
      "path": "authority/review-queue-draft/review-p0-document-root-1f.json",
      "digest": "sha256:4fb27261d0bc2ec5b7e8df33775cb58db5c50325e43a91fd43ec11198e607fc5",
      "priority": 0,
      "semantic_kind": "document-root",
      "bucket": "1f",
      "items": 1
    },
    {
      "id": "review-p0-document-root-20",
      "path": "authority/review-queue-draft/review-p0-document-root-20.json",
      "digest": "sha256:58f5a47844b761e6a22cca9c52952b35adc8003dc45971ed8a088306338dc401",
      "priority": 0,
      "semantic_kind": "document-root",
      "bucket": "20",
      "items": 1
    },
    {
      "id": "review-p0-document-root-22",
      "path": "authority/review-queue-draft/review-p0-document-root-22.json",